<?xml version="1.0" encoding="UTF-8"?>
<danielpm1982:shipOrderList
	xmlns:xsi="http://www.w3.org/2001/XMLSchema-instance"
	xsi:schemaLocation="http://www.danielpm1982.com/ShipOrderNamedTypesMethodIndicators ShipOrderNamedTypesMethodIndicators.xsd"
	xmlns:danielpm1982="http://www.danielpm1982.com/ShipOrderNamedTypesMethodIndicators"
	danielpm1982:orderListId="1">
	<danielpm1982:shipOrder
		danielpm1982:orderId="505" danielpm1982:orderProcessed="true"
		danielpm1982:orderPayed="true" danielpm1982:orderShipped="true"
		danielpm1982:orderDelivered="false">
		<danielpm1982:client>client1</danielpm1982:client>
		<danielpm1982:shipTo>
			<danielpm1982:name>person1</danielpm1982:name>
			<danielpm1982:address>person1Address</danielpm1982:address>
			<danielpm1982:email>person1Email</danielpm1982:email>
			<danielpm1982:city>person1City</danielpm1982:city>
			<danielpm1982:state>person1State</danielpm1982:state>
			<danielpm1982:country>person1Country</danielpm1982:country>
			<danielpm1982:zipCode>60000000</danielpm1982:zipCode>
		</danielpm1982:shipTo>
		<danielpm1982:service>
			<danielpm1982:firstClassMail>true</danielpm1982:firstClassMail>
		</danielpm1982:service>
		<danielpm1982:item>
			<danielpm1982:title>item1</danielpm1982:title>
			<danielpm1982:quantity>5</danielpm1982:quantity>
			<danielpm1982:price>10.0</danielpm1982:price>
		</danielpm1982:item>
		<danielpm1982:item>
			<danielpm1982:title>item2</danielpm1982:title>
			<danielpm1982:quantity>15</danielpm1982:quantity>
			<danielpm1982:price>20.5</danielpm1982:price>
		</danielpm1982:item>
		<danielpm1982:item>
			<danielpm1982:title>item3</danielpm1982:title>
			<danielpm1982:quantity>20</danielpm1982:quantity>
			<danielpm1982:price>5.9</danielpm1982:price>
		</danielpm1982:item>
		<danielpm1982:discountTicket>DISCOUNT_TICKET_20</danielpm1982:discountTicket>
		<danielpm1982:dateTime>2019-10-19T15:00:00</danielpm1982:dateTime>
	</danielpm1982:shipOrder>
	<danielpm1982:shipOrder
		danielpm1982:orderId="802"
		danielpm1982:orderProcessed="true"
		danielpm1982:orderPayed="false"
		danielpm1982:orderShipped="false"
		danielpm1982:orderDelivered="false">
		<danielpm1982:client>client1</danielpm1982:client>
		<danielpm1982:shipTo>
			<danielpm1982:name>person2</danielpm1982:name>
			<danielpm1982:address>person2Address</danielpm1982:address>
			<danielpm1982:email>person2Email</danielpm1982:email>
			<danielpm1982:city>person2City</danielpm1982:city>
			<danielpm1982:state>person2State</danielpm1982:state>
			<danielpm1982:country>person2Country</danielpm1982:country>
			<danielpm1982:zipCode>60000000</danielpm1982:zipCode>
		</danielpm1982:shipTo>
		<danielpm1982:service>
			<danielpm1982:priorityMailExpress>true</danielpm1982:priorityMailExpress>
		</danielpm1982:service>
		<danielpm1982:item>
			<danielpm1982:title>item4</danielpm1982:title>
			<danielpm1982:quantity>3</danielpm1982:quantity>
			<danielpm1982:price>20.0</danielpm1982:price>
		</danielpm1982:item>
		<danielpm1982:item>
			<danielpm1982:title>item5</danielpm1982:title>
			<danielpm1982:quantity>1</danielpm1982:quantity>
			<danielpm1982:price>90.5</danielpm1982:price>
		</danielpm1982:item>
		<danielpm1982:discountTicket>DISCOUNT_TICKET_50</danielpm1982:discountTicket>
		<danielpm1982:dateTime>2019-10-19T16:00:00</danielpm1982:dateTime>
	</danielpm1982:shipOrder>
</danielpm1982:shipOrderList>
